{
  "$schema": "./ModuleDoc.schema.json",
  "autoGeneratedHeader": false,
  "name": "__filename",
  "type": "global",
  "status": "supported",
  "docsUrl": "https://nodejs.org/api/modules.html#filename",
  "nodeVersionTarget": "22.x LTS",
  "implementation": "src/JavaScriptRuntime/Node/GlobalVariables.cs",
  "tests": [
    {
      "name": "Jroc.Tests.Node.ExecutionTests.Environment_EnumerateProcessArgV",
      "file": "tests/Jroc.Tests/Node/ExecutionTests.cs#L21"
    },
    {
      "name": "Jroc.Tests.Node.GeneratorTests.Environment_EnumerateProcessArgV",
      "file": "tests/Jroc.Tests/Node/GeneratorTests.cs"
    }
  ]
}
