{
  "$schema": "./ModuleDoc.schema.json",
  "autoGeneratedHeader": false,
  "name": "console",
  "type": "module",
  "status": "partial",
  "docsUrl": "https://nodejs.org/api/console.html",
  "nodeVersionTarget": "22.x LTS",
  "implementation": [
    "src/JavaScriptRuntime/Node/ConsoleModule.cs",
    "src/JavaScriptRuntime/Console.cs"
  ],
  "notes": "Supports require('console') and require('node:console'). The module exports a constructible Console class for routing output to JROC writable streams.",
  "apis": [
    {
      "name": "Console(options)",
      "kind": "property",
      "status": "partial",
      "docs": "https://nodejs.org/api/console.html#new-consoleoptions",
      "notes": "Supports object-form construction with stdout, optional stderr, and inspectOptions. stdout and stderr must be JROC Writable streams.",
      "tests": [
        {
          "name": "Jroc.Tests.Node.Console.ExecutionTests.Console_Undici_Transform_Table",
          "file": "tests/Jroc.Tests/Node/Console/ExecutionTests.cs"
        },
        {
          "name": "Jroc.Tests.Node.Console.GeneratorTests.Console_Undici_Transform_Table",
          "file": "tests/Jroc.Tests/Node/Console/GeneratorTests.cs"
        }
      ]
    },
    {
      "name": "console.log(...data)",
      "kind": "function",
      "status": "supported",
      "docs": "https://nodejs.org/api/console.html#consolelogdata",
      "notes": "Writes formatted values followed by a newline to stdout.",
      "tests": [
        {
          "name": "Jroc.Tests.ConsoleTests.Log_PrintsAllArgumentsWithSpaces",
          "file": "tests/Jroc.Tests/ConsoleTests.cs"
        }
      ]
    },
    {
      "name": "console.warn(...data)",
      "kind": "function",
      "status": "supported",
      "docs": "https://nodejs.org/api/console.html#consolewarndata",
      "notes": "Writes formatted values followed by a newline to stderr.",
      "tests": [
        {
          "name": "Jroc.Tests.ConsoleTests.Warn_PrintsAllArgumentsWithSpaces_ToStdErr",
          "file": "tests/Jroc.Tests/ConsoleTests.cs"
        }
      ]
    },
    {
      "name": "console.error(...data)",
      "kind": "function",
      "status": "supported",
      "docs": "https://nodejs.org/api/console.html#consoleerrordata",
      "notes": "Writes formatted values followed by a newline to stderr.",
      "tests": [
        {
          "name": "Jroc.Tests.ConsoleTests.Error_PrintsAllArgumentsWithSpaces_ToStdErr",
          "file": "tests/Jroc.Tests/ConsoleTests.cs"
        }
      ]
    },
    {
      "name": "console.table(tabularData)",
      "kind": "function",
      "status": "partial",
      "docs": "https://nodejs.org/api/console.html#consoletabletabulardata-properties",
      "notes": "Formats arrays of object rows into a text table and writes the result to stdout. The optional properties argument and advanced Node table formatting are not yet supported.",
      "tests": [
        {
          "name": "Jroc.Tests.Node.Console.ExecutionTests.Console_Undici_Transform_Table",
          "file": "tests/Jroc.Tests/Node/Console/ExecutionTests.cs"
        },
        {
          "name": "Jroc.Tests.Node.Console.GeneratorTests.Console_Undici_Transform_Table",
          "file": "tests/Jroc.Tests/Node/Console/GeneratorTests.cs"
        }
      ]
    }
  ]
}
