{
  "$schema": "./ModuleDoc.schema.json",
  "autoGeneratedHeader": false,
  "name": "console.warn",
  "type": "global",
  "status": "supported",
  "docsUrl": "https://nodejs.org/api/console.html#consolewarndata-args",
  "nodeVersionTarget": "22.x LTS",
  "implementation": "src/JavaScriptRuntime/Console.cs",
  "notes": "Writes to stderr.",
  "tests": [
    {
      "name": "JavaScriptRuntime.Tests.ConsoleTests.Warn_PrintsAllArgumentsWithSpaces",
      "file": "tests/Jroc.Tests/ConsoleTests.cs"
    }
  ]
}
