{
  "$schema": "./ModuleDoc.schema.json",
  "autoGeneratedHeader": false,
  "name": "clearInterval",
  "type": "global",
  "status": "supported",
  "docsUrl": "https://nodejs.org/api/timers.html#clearintervaltimeout",
  "nodeVersionTarget": "22.x LTS",
  "implementation": "src/JavaScriptRuntime/GlobalThis.cs, src/JavaScriptRuntime/Timers.cs, src/JavaScriptRuntime/Engine/NodeSchedulerState.cs, src/JavaScriptRuntime/Engine/NodeEventLoopPump.cs",
  "notes": "Cancels a repeating timer that was previously created with setInterval. Returns undefined (null in .NET).",
  "tests": [
    {
      "name": "Jroc.Tests.Node.ExecutionTests.SetInterval_ExecutesThreeTimes_ThenClears",
      "file": "tests/Jroc.Tests/Node/ExecutionTests.cs"
    }
  ]
}
