{
  "$schema": "./ModuleDoc.schema.json",
  "autoGeneratedHeader": false,
  "name": "buffer",
  "fileName": "buffer_module",
  "type": "module",
  "status": "partial",
  "docsUrl": "https://nodejs.org/api/buffer.html",
  "nodeVersionTarget": "22.x LTS",
  "implementation": [
    "src/JavaScriptRuntime/Node/BufferModule.cs",
    "src/JavaScriptRuntime/Node/Buffer.cs"
  ],
  "notes": "Supports require('buffer') and require('node:buffer'). It exports the global Buffer constructor, isUtf8 for Buffer/ArrayBuffer/typed-array inputs, and resolveObjectURL. Blob object URL creation is not yet supported, so resolveObjectURL returns undefined for all inputs.",
  "apis": [
    {
      "name": "Buffer",
      "kind": "property",
      "status": "supported",
      "docs": "https://nodejs.org/api/buffer.html#class-buffer",
      "notes": "Exports the same constructor as globalThis.Buffer, including base64/utf8 decoding, allocation, concatenation, binary integer I/O, views, and array-like indexing.",
      "tests": [
        {
          "name": "Jroc.Tests.Node.Buffer.ExecutionTests.Require_Buffer_Undici_Core",
          "file": "tests/Jroc.Tests/Node/Buffer/ExecutionTests.cs"
        },
        {
          "name": "Jroc.Tests.Node.Buffer.GeneratorTests.Require_Buffer_Undici_Core",
          "file": "tests/Jroc.Tests/Node/Buffer/GeneratorTests.cs"
        }
      ]
    },
    {
      "name": "Buffer.from(value[, encoding])",
      "kind": "function",
      "status": "supported",
      "docs": "https://nodejs.org/api/buffer.html#static-method-bufferfromarray",
      "notes": "Creates a Buffer from a Buffer, byte array, JavaScript array, enumerable value, or string with utf8, hex, or base64 decoding."
    },
    {
      "name": "Buffer.alloc(size[, fill[, encoding]])",
      "kind": "function",
      "status": "supported",
      "docs": "https://nodejs.org/api/buffer.html#static-method-bufferallocsize-fill-encoding",
      "notes": "Allocates a zeroed Buffer, optionally filled from a byte, string, or Buffer."
    },
    {
      "name": "Buffer.allocUnsafe(size)",
      "kind": "function",
      "status": "supported",
      "docs": "https://nodejs.org/api/buffer.html#static-method-bufferallocunsafesize",
      "notes": "Allocates an uninitialized Buffer."
    },
    {
      "name": "Buffer.byteLength(value[, encoding])",
      "kind": "function",
      "status": "supported",
      "docs": "https://nodejs.org/api/buffer.html#static-method-bufferbytelengthstring-encoding",
      "notes": "Returns the encoded byte length of a Buffer, byte array, or string."
    },
    {
      "name": "Buffer.concat(list[, totalLength])",
      "kind": "function",
      "status": "supported",
      "docs": "https://nodejs.org/api/buffer.html#static-method-bufferconcatlist-totallength",
      "notes": "Concatenates Buffer-compatible binary values, optionally truncating or padding to totalLength."
    },
    {
      "name": "Buffer.isBuffer(value)",
      "kind": "function",
      "status": "supported",
      "docs": "https://nodejs.org/api/buffer.html#static-method-bufferisbufferobj",
      "notes": "Returns whether value is a JROC Buffer."
    },
    {
      "name": "Buffer.compare(buf1, buf2)",
      "kind": "function",
      "status": "supported",
      "docs": "https://nodejs.org/api/buffer.html#static-method-buffercomparebuf1-buf2",
      "notes": "Lexicographically compares two Buffers."
    },
    {
      "name": "buffer.length / buffer.byteLength / buffer.byteOffset / buffer.buffer",
      "kind": "property",
      "status": "supported",
      "docs": "https://nodejs.org/api/buffer.html#bufbuffer",
      "notes": "Exposes view length, byte length, byte offset, and the backing ArrayBuffer."
    },
    {
      "name": "buffer[index]",
      "kind": "property",
      "status": "supported",
      "docs": "https://nodejs.org/api/buffer.html#bufindex",
      "notes": "Supports indexed byte reads and writes for in-bounds integer indexes."
    },
    {
      "name": "buffer.toString([encoding[, start[, end]]])",
      "kind": "function",
      "status": "supported",
      "docs": "https://nodejs.org/api/buffer.html#buftostringencoding-start-end",
      "notes": "Decodes Buffer contents using utf8, hex, or base64 encoding."
    },
    {
      "name": "buffer.slice([start[, end]]) / buffer.subarray([start[, end]])",
      "kind": "function",
      "status": "supported",
      "docs": "https://nodejs.org/api/buffer.html#bufsubarraystart-end",
      "notes": "Returns Buffer views over the existing backing storage."
    },
    {
      "name": "buffer.copy(target[, targetStart[, sourceStart[, sourceEnd]]])",
      "kind": "function",
      "status": "supported",
      "docs": "https://nodejs.org/api/buffer.html#bufcopytarget-targetstart-sourcestart-sourceend",
      "notes": "Copies bytes into a target Buffer and returns the copied byte count."
    },
    {
      "name": "buffer.equals(other)",
      "kind": "function",
      "status": "supported",
      "docs": "https://nodejs.org/api/buffer.html#bufequalsotherbuffer",
      "notes": "Compares Buffer contents for equality."
    },
    {
      "name": "buffer.indexOf(value[, byteOffset[, encoding]]) / buffer.lastIndexOf(value[, byteOffset[, encoding]]) / buffer.includes(value[, byteOffset[, encoding]])",
      "kind": "function",
      "status": "supported",
      "docs": "https://nodejs.org/api/buffer.html#bufindexofvalue-byteoffset-encoding",
      "notes": "Searches for byte, string, or Buffer values."
    },
    {
      "name": "buffer.fill(value[, offset[, end[, encoding]]])",
      "kind": "function",
      "status": "supported",
      "docs": "https://nodejs.org/api/buffer.html#buffillvalue-offset-end-encoding",
      "notes": "Fills a Buffer range from a byte, string, or Buffer value."
    },
    {
      "name": "buffer.write(string[, offset[, length[, encoding]]])",
      "kind": "function",
      "status": "supported",
      "docs": "https://nodejs.org/api/buffer.html#bufwritestring-offset-length-encoding",
      "notes": "Writes an encoded string and returns the number of bytes written."
    },
    {
      "name": "buffer.readInt8/readUInt8/readInt16BE/readInt16LE/readUInt16BE/readUInt16LE/readInt32BE/readInt32LE/readUInt32BE/readUInt32LE",
      "kind": "function",
      "status": "supported",
      "docs": "https://nodejs.org/api/buffer.html#buffer",
      "notes": "Reads signed and unsigned 8-, 16-, and 32-bit integer values in big- and little-endian formats."
    },
    {
      "name": "buffer.writeInt8/writeUInt8/writeInt16BE/writeInt16LE/writeUInt16BE/writeUInt16LE/writeInt32BE/writeInt32LE/writeUInt32BE/writeUInt32LE",
      "kind": "function",
      "status": "supported",
      "docs": "https://nodejs.org/api/buffer.html#buffer",
      "notes": "Writes signed and unsigned 8-, 16-, and 32-bit integer values in big- and little-endian formats."
    },
    {
      "name": "buffer.readFloatLE/readFloatBE/readDoubleLE/readDoubleBE",
      "kind": "function",
      "status": "supported",
      "docs": "https://nodejs.org/api/buffer.html#buffer",
      "notes": "Reads IEEE 754 single- and double-precision values in big- and little-endian formats."
    },
    {
      "name": "buffer.writeFloatLE/writeFloatBE/writeDoubleLE/writeDoubleBE",
      "kind": "function",
      "status": "supported",
      "docs": "https://nodejs.org/api/buffer.html#buffer",
      "notes": "Writes IEEE 754 single- and double-precision values in big- and little-endian formats."
    },
    {
      "name": "isUtf8(input)",
      "kind": "function",
      "status": "supported",
      "docs": "https://nodejs.org/api/buffer.html#bufferisutf8input",
      "notes": "Returns whether a Buffer, ArrayBuffer, or typed-array input contains well-formed UTF-8.",
      "tests": [
        {
          "name": "Jroc.Tests.Node.Buffer.ExecutionTests.Require_Buffer_Undici_Core",
          "file": "tests/Jroc.Tests/Node/Buffer/ExecutionTests.cs"
        },
        {
          "name": "Jroc.Tests.Node.Buffer.GeneratorTests.Require_Buffer_Undici_Core",
          "file": "tests/Jroc.Tests/Node/Buffer/GeneratorTests.cs"
        }
      ]
    },
    {
      "name": "resolveObjectURL(id)",
      "kind": "function",
      "status": "partial",
      "docs": "https://nodejs.org/api/buffer.html#bufferresolveobjecturlid",
      "notes": "Exported for Undici compatibility. Blob object URL creation is not yet supported, so this returns undefined.",
      "tests": [
        {
          "name": "Jroc.Tests.Node.Buffer.ExecutionTests.Require_Buffer_Undici_Core",
          "file": "tests/Jroc.Tests/Node/Buffer/ExecutionTests.cs"
        },
        {
          "name": "Jroc.Tests.Node.Buffer.GeneratorTests.Require_Buffer_Undici_Core",
          "file": "tests/Jroc.Tests/Node/Buffer/GeneratorTests.cs"
        }
      ]
    }
  ]
}
