{
  "$schema": "./ModuleDoc.schema.json",
  "autoGeneratedHeader": false,
  "name": "async_hooks",
  "type": "module",
  "status": "partial",
  "docsUrl": "https://nodejs.org/api/async_hooks.html",
  "nodeVersionTarget": "24.x LTS",
  "implementation": [
    "src/JavaScriptRuntime/Node/AsyncHooks.cs",
    "src/JavaScriptRuntime/Node/Contracts/IAsyncHooksModule.Generated.cs"
  ],
  "notes": "Supports the AsyncResource behavior required by Undici, AsyncLocalStorage propagation through Promise, nextTick, timer, immediate, and fs callback boundaries, explicit async hook lifecycle events, and promiseResolve events. State is isolated per engine and context capture allocates only while a store is active. The deprecated asyncWrapProviders export remains explicit but unavailable.",
  "apis": [
    {
      "name": "AsyncResource",
      "kind": "property",
      "status": "supported",
      "docs": "https://nodejs.org/api/async_context.html#class-asyncresource",
      "notes": "Supports direct construction, JavaScript subclassing, runInAsyncScope, bind, emitDestroy, asyncId, triggerAsyncId, receiver and argument forwarding, return values, exceptions, and nested restoration.",
      "tests": [
        {
          "name": "Jroc.Tests.Node.AsyncHooks.ExecutionTests.Require_AsyncHooks_AsyncResource_Subclass",
          "file": "tests/Jroc.Tests/Node/AsyncHooks/ExecutionTests.cs"
        }
      ]
    },
    {
      "name": "AsyncLocalStorage",
      "kind": "property",
      "status": "supported",
      "docs": "https://nodejs.org/api/async_context.html#class-asynclocalstorage",
      "notes": "Supports run, enterWith, getStore, exit, disable, bind, snapshot, name, defaultValue, nested stores, sibling isolation, and propagation across supported scheduling and I/O boundaries.",
      "tests": [
        {
          "name": "Jroc.Tests.Node.AsyncHooks.ExecutionTests.Require_AsyncHooks_AsyncLocalStorage_Propagation",
          "file": "tests/Jroc.Tests/Node/AsyncHooks/ExecutionTests.cs"
        }
      ]
    },
    {
      "name": "createHook / AsyncHook",
      "kind": "function",
      "status": "partial",
      "docs": "https://nodejs.org/api/async_hooks.html#async_hookscreatehookcallbacks",
      "notes": "Supports enable, disable, and init/before/after/destroy lifecycle events for explicit AsyncResource instances plus init/promiseResolve for instrumented Promises. Other built-in resource types are not yet instrumented.",
      "tests": [
        {
          "name": "Jroc.Tests.Node.AsyncHooks.ExecutionTests.Require_AsyncHooks_CreateHook",
          "file": "tests/Jroc.Tests/Node/AsyncHooks/ExecutionTests.cs"
        }
      ]
    },
    {
      "name": "executionAsyncId / triggerAsyncId / executionAsyncResource",
      "kind": "function",
      "status": "supported",
      "docs": "https://nodejs.org/api/async_hooks.html#async_hooksexecutionasyncid"
    },
    {
      "name": "asyncWrapProviders",
      "kind": "property",
      "status": "not-supported",
      "docs": "https://nodejs.org/api/async_hooks.html#async_hooksasyncwrapproviders",
      "notes": "The deprecated provider table remains in the generated Node 24 contract and throws NotImplementedException explicitly."
    }
  ]
}
