{
  "$schema": "./ModuleDoc.schema.json",
  "autoGeneratedHeader": false,
  "name": "fs/promises",
  "type": "module",
  "status": "partial",
  "docsUrl": "https://nodejs.org/api/fs.html#fspromisesapi",
  "nodeVersionTarget": "22.x LTS",
  "implementation": [
    "src/JavaScriptRuntime/Node/FSPromises.cs",
    "src/JavaScriptRuntime/Node/FsFileHandle.cs",
    "src/JavaScriptRuntime/Node/FsCommon.cs"
  ],
  "notes": "The current fs/promises baseline covers whole-file helpers plus FileHandle open/read/write/close, richer stat/lstat metadata, createReadStream/createWriteStream support exposed from node:fs, and practical mutation helpers. Supported FileHandle flags are r, r+, w, w+, a, and a+. Async-iterator file watching and raw numeric-fd callback parity remain unsupported follow-ons.",
  "apis": [
    {
      "name": "access(path, mode)",
      "kind": "function",
      "status": "supported",
      "notes": "Resolves when path exists, rejects otherwise. Mode is accepted but not enforced.",
      "docs": "https://nodejs.org/api/fs.html#fspromisesaccesspath-mode"
    },
    {
      "name": "readdir(path, { withFileTypes: true })",
      "kind": "function",
      "status": "supported",
      "notes": "Returns an array of DirEnt-like objects with properties: name and methods isDirectory(), isFile().",
      "docs": "https://nodejs.org/api/fs.html#fspromisesreaddirpath-options"
    },
    {
      "name": "mkdir(path, { recursive: true })",
      "kind": "function",
      "status": "supported",
      "notes": "Creates directories recursively.",
      "docs": "https://nodejs.org/api/fs.html#fspromisesmkdirpath-options"
    },
    {
      "name": "copyFile(src, dest)",
      "kind": "function",
      "status": "supported",
      "notes": "Copies a file from src to dest (overwrites if destination exists).",
      "docs": "https://nodejs.org/api/fs.html#fspromisescopyfilesrc-dest-mode"
    },
    {
      "name": "open(path[, flags[, mode]])",
      "kind": "function",
      "status": "supported",
      "notes": "Returns a Promise resolving to a FileHandle supporting fd/read/write/close in the current baseline. Supported flags: r, r+, w, w+, a, and a+.",
      "docs": "https://nodejs.org/api/fs.html#fspromisesopenpath-flags-mode",
      "tests": [
        {
          "name": "Jroc.Tests.Node.FS.ExecutionTests.FSPromises_Open_Read_Write_Close",
          "file": "tests/Jroc.Tests/Node/FS/ExecutionTests.cs"
        },
        {
          "name": "Jroc.Tests.Node.FS.GeneratorTests.FSPromises_Open_Read_Write_Close",
          "file": "tests/Jroc.Tests/Node/FS/GeneratorTests.cs"
        }
      ]
    },
    {
      "name": "readFile(path, options)",
      "kind": "function",
      "status": "supported",
      "notes": "Returns a Promise resolving to Buffer by default, or string when encoding option is 'utf8'. Supports 'utf8' encoding.",
      "docs": "https://nodejs.org/api/fs.html#fspromisesreadfilepath-options"
    },
    {
      "name": "writeFile(path, data, options)",
      "kind": "function",
      "status": "supported",
      "notes": "Writes data to a file, creating or overwriting it. Supports Buffer, byte array, or string content. Supports 'utf8' encoding option.",
      "docs": "https://nodejs.org/api/fs.html#fspromiseswritefilefile-data-options"
    },
    {
      "name": "appendFile(path, data[, options])",
      "kind": "function",
      "status": "supported",
      "notes": "Appends Buffer, byte array, or string content to a file using the same utf8 encoding baseline as writeFile.",
      "docs": "https://nodejs.org/api/fs.html#fspromisesappendfilepath-data-options",
      "tests": [
        {
          "name": "Jroc.Tests.Node.FS.ExecutionTests.FSPromises_Append_Rename_Unlink",
          "file": "tests/Jroc.Tests/Node/FS/ExecutionTests.cs"
        },
        {
          "name": "Jroc.Tests.Node.FS.GeneratorTests.FSPromises_Append_Rename_Unlink",
          "file": "tests/Jroc.Tests/Node/FS/GeneratorTests.cs"
        }
      ]
    },
    {
      "name": "rename(oldPath, newPath)",
      "kind": "function",
      "status": "supported",
      "notes": "Renames files or directories with Node-like ENOENT/EACCES/EIO style errors in the supported baseline.",
      "docs": "https://nodejs.org/api/fs.html#fspromisesrenameoldpath-newpath",
      "tests": [
        {
          "name": "Jroc.Tests.Node.FS.ExecutionTests.FSPromises_Append_Rename_Unlink",
          "file": "tests/Jroc.Tests/Node/FS/ExecutionTests.cs"
        },
        {
          "name": "Jroc.Tests.Node.FS.GeneratorTests.FSPromises_Append_Rename_Unlink",
          "file": "tests/Jroc.Tests/Node/FS/GeneratorTests.cs"
        }
      ]
    },
    {
      "name": "unlink(path)",
      "kind": "function",
      "status": "supported",
      "notes": "Removes files with Node-like ENOENT/EISDIR/EACCES error reporting in the supported baseline.",
      "docs": "https://nodejs.org/api/fs.html#fspromisesunlinkpath",
      "tests": [
        {
          "name": "Jroc.Tests.Node.FS.ExecutionTests.FSPromises_Append_Rename_Unlink",
          "file": "tests/Jroc.Tests/Node/FS/ExecutionTests.cs"
        },
        {
          "name": "Jroc.Tests.Node.FS.GeneratorTests.FSPromises_Append_Rename_Unlink",
          "file": "tests/Jroc.Tests/Node/FS/GeneratorTests.cs"
        }
      ]
    },
    {
      "name": "stat(path)",
      "kind": "function",
      "status": "supported",
      "notes": "Returns a Promise resolving to a richer Stats-like object with size, mode, atime/mtime/ctime/birthtime plus their `*Ms` number variants, and the common type predicates. `mode` and permission bits are best-effort platform-derived values, and `ctime` / `birthtime` currently both map to platform creation metadata. Rejects if path doesn't exist.",
      "docs": "https://nodejs.org/api/fs.html#fspromisesstatpath-options",
      "tests": [
        {
          "name": "Jroc.Tests.Node.FS.ExecutionTests.FSPromises_Stat_FileSize",
          "file": "tests/Jroc.Tests/Node/FS/ExecutionTests.cs"
        },
        {
          "name": "Jroc.Tests.Node.FS.ExecutionTests.FSPromises_Stat_RichMetadata",
          "file": "tests/Jroc.Tests/Node/FS/ExecutionTests.cs"
        },
        {
          "name": "Jroc.Tests.Node.FS.GeneratorTests.FSPromises_Stat_FileSize",
          "file": "tests/Jroc.Tests/Node/FS/GeneratorTests.cs"
        },
        {
          "name": "Jroc.Tests.Node.FS.GeneratorTests.FSPromises_Stat_RichMetadata",
          "file": "tests/Jroc.Tests/Node/FS/GeneratorTests.cs"
        }
      ]
    },
    {
      "name": "lstat(path)",
      "kind": "function",
      "status": "supported",
      "notes": "Currently behaves the same as stat() due to .NET limitations, including the richer Stats-like metadata surface. `mode` and permission bits are best-effort platform-derived values, and `ctime` / `birthtime` currently both map to platform creation metadata.",
      "docs": "https://nodejs.org/api/fs.html#fspromiseslstatpath-options"
    },
    {
      "name": "watch(filename[, options])",
      "kind": "function",
      "status": "not-supported",
      "notes": "Async-iterator-based file watching is not implemented yet in the current runtime, so watch-driven promise workflows still require a host fallback.",
      "docs": "https://nodejs.org/api/fs.html#fspromiseswatchfilename-options"
    },
    {
      "name": "realpath(path)",
      "kind": "function",
      "status": "supported",
      "notes": "Returns a Promise resolving to the absolute path using Path.GetFullPath().",
      "docs": "https://nodejs.org/api/fs.html#fspromisesrealpathpath-options"
    }
  ]
}
