{
  "$schema": "./ModuleDoc.schema.json",
  "autoGeneratedHeader": false,
  "name": "URLSearchParams",
  "type": "global",
  "status": "partial",
  "docsUrl": "https://nodejs.org/api/url.html#class-urlsearchparams",
  "nodeVersionTarget": "22.x LTS",
  "implementation": [
    "src/JavaScriptRuntime/GlobalThis.cs",
    "src/JavaScriptRuntime/Node/Url.cs"
  ],
  "notes": "Exposes the WHATWG `URLSearchParams` constructor on `globalThis` and reuses the same constructor object exported by `require(\"url\")` / `require(\"node:url\")`, including `Function.prototype` linkage, `.prototype`, `.constructor`, and `new`-required behavior within the current focused URLSearchParams feature slice.",
  "tests": [
    {
      "name": "Jroc.Tests.Node.Url.ExecutionTests.Global_Url_And_SearchParams",
      "file": "tests/Jroc.Tests/Node/Url/ExecutionTests.cs"
    },
    {
      "name": "Jroc.Tests.Node.Url.GeneratorTests.Global_Url_And_SearchParams",
      "file": "tests/Jroc.Tests/Node/Url/GeneratorTests.cs"
    }
  ]
}
