{
  "$schema": "./ModuleDoc.schema.json",
  "autoGeneratedHeader": false,
  "name": "clearImmediate",
  "type": "global",
  "status": "supported",
  "docsUrl": "https://nodejs.org/api/timers.html#clearimmediateimmediate",
  "nodeVersionTarget": "22.x LTS",
  "implementation": "src/JavaScriptRuntime/GlobalThis.cs, src/JavaScriptRuntime/Timers.cs, src/JavaScriptRuntime/Engine/NodeSchedulerState.cs, src/JavaScriptRuntime/Engine/NodeEventLoopPump.cs",
  "notes": "Cancels an immediate that was previously created with setImmediate. Returns undefined (null in .NET).",
  "tests": [
    {
      "name": "Jroc.Tests.Node.ExecutionTests.ClearImmediate_CancelsCallback",
      "file": "tests/Jroc.Tests/Node/ExecutionTests.cs"
    }
  ]
}
