{
  "$schema": "./ModuleDoc.schema.json",
  "autoGeneratedHeader": false,
  "name": "console.log",
  "type": "global",
  "status": "supported",
  "docsUrl": "https://nodejs.org/api/console.html#consolelogdata-args",
  "nodeVersionTarget": "22.x LTS",
  "implementation": "src/JavaScriptRuntime/Console.cs",
  "tests": [
    {
      "name": "Jroc.Tests.ConsoleTests",
      "file": "tests/Jroc.Tests/ConsoleTests.cs"
    }
  ]
}
