{
  "$schema": "./ModuleDoc.schema.json",
  "autoGeneratedHeader": false,
  "name": "Buffer",
  "type": "global",
  "status": "supported",
  "docsUrl": "https://nodejs.org/api/buffer.html#class-buffer",
  "nodeVersionTarget": "22.x LTS",
  "implementation": "src/JavaScriptRuntime/Node/Buffer.cs",
  "notes": "Buffer is seeded as a global binding, so `Buffer.from` and other APIs work through both direct intrinsic calls and dynamic global lookup. Core Buffer APIs are implemented for binary workflows: legacy Buffer constructor forms (`new Buffer(value[, encoding])` and `new Buffer(size)`), Buffer.from/isBuffer/alloc/allocUnsafe/byteLength/concat/compare, instance methods (slice/subarray/copy/write/fill/equals/indexOf/lastIndexOf/includes/toString/length), binary-view metadata (`buffer`, `byteOffset`, `byteLength`), array-like indexing (buffer[i]), and binary read/write methods for Int8/16/32, UInt8/16/32, FloatLE/BE, and DoubleLE/BE with utf8/base64/hex encoding support.",
  "tests": [
    {
      "name": "Jroc.Tests.Node.Buffer.ExecutionTests.Buffer_From_And_IsBuffer",
      "file": "tests/Jroc.Tests/Node/Buffer/ExecutionTests.cs"
    },
    {
      "name": "Jroc.Tests.Node.Buffer.ExecutionTests.Buffer_Alloc_ByteLength_Concat",
      "file": "tests/Jroc.Tests/Node/Buffer/ExecutionTests.cs"
    },
    {
      "name": "Jroc.Tests.Node.Buffer.ExecutionTests.Buffer_Slice_Copy_IndexAccess",
      "file": "tests/Jroc.Tests/Node/Buffer/ExecutionTests.cs"
    },
    {
      "name": "Jroc.Tests.Node.Buffer.ExecutionTests.Buffer_AllocUnsafe_Compare",
      "file": "tests/Jroc.Tests/Node/Buffer/ExecutionTests.cs"
    },
    {
      "name": "Jroc.Tests.Node.Buffer.ExecutionTests.Buffer_ReadWrite_Methods",
      "file": "tests/Jroc.Tests/Node/Buffer/ExecutionTests.cs"
    },
    {
      "name": "Jroc.Tests.Node.Buffer.ExecutionTests.Buffer_Advanced_CoreApis",
      "file": "tests/Jroc.Tests/Node/Buffer/ExecutionTests.cs"
    },
    {
      "name": "Jroc.Tests.Node.Buffer.ExecutionTests.Buffer_Constructor_Legacy",
      "file": "tests/Jroc.Tests/Node/Buffer/ExecutionTests.cs"
    },
    {
      "name": "Jroc.Tests.Node.Buffer.GeneratorTests.Buffer_From_And_IsBuffer",
      "file": "tests/Jroc.Tests/Node/Buffer/GeneratorTests.cs"
    },
    {
      "name": "Jroc.Tests.Node.Buffer.GeneratorTests.Buffer_Alloc_ByteLength_Concat",
      "file": "tests/Jroc.Tests/Node/Buffer/GeneratorTests.cs"
    },
    {
      "name": "Jroc.Tests.Node.Buffer.GeneratorTests.Buffer_Slice_Copy_IndexAccess",
      "file": "tests/Jroc.Tests/Node/Buffer/GeneratorTests.cs"
    },
    {
      "name": "Jroc.Tests.Node.Buffer.GeneratorTests.Buffer_AllocUnsafe_Compare",
      "file": "tests/Jroc.Tests/Node/Buffer/GeneratorTests.cs"
    },
    {
      "name": "Jroc.Tests.Node.Buffer.GeneratorTests.Buffer_ReadWrite_Methods",
      "file": "tests/Jroc.Tests/Node/Buffer/GeneratorTests.cs"
    },
    {
      "name": "Jroc.Tests.Node.Buffer.GeneratorTests.Buffer_Advanced_CoreApis",
      "file": "tests/Jroc.Tests/Node/Buffer/GeneratorTests.cs"
    },
    {
      "name": "Jroc.Tests.Node.Buffer.GeneratorTests.Buffer_Constructor_Legacy",
      "file": "tests/Jroc.Tests/Node/Buffer/GeneratorTests.cs"
    }
  ]
}