{
  "$schema": "./ModuleDoc.schema.json",
  "autoGeneratedHeader": false,
  "name": "string_decoder",
  "type": "module",
  "status": "partial",
  "docsUrl": "https://nodejs.org/api/string_decoder.html",
  "nodeVersionTarget": "22.x LTS",
  "implementation": "src/JavaScriptRuntime/Node/StringDecoderModule.cs",
  "notes": "Supports utf8 and utf-8 only. Both require('string_decoder') and require('node:string_decoder') resolve to the module.",
  "apis": [
    {
      "name": "StringDecoder(encoding)",
      "kind": "function",
      "status": "partial",
      "notes": "Constructs a decoder that exposes write(buffer) and end([buffer]) for buffered utf8 decoding.",
      "docs": "https://nodejs.org/api/string_decoder.html#new-stringdecoderencoding",
      "tests": [
        {
          "name": "Jroc.Tests.Node.StringDecoder.ExecutionTests.Require_StringDecoder_Utf8_Basic",
          "file": "tests/Jroc.Tests/Node/StringDecoder/ExecutionTests.cs"
        },
        {
          "name": "Jroc.Tests.Node.StringDecoder.ExecutionTests.Require_StringDecoder_NodePrefix",
          "file": "tests/Jroc.Tests/Node/StringDecoder/ExecutionTests.cs"
        },
        {
          "name": "Jroc.Tests.Node.StringDecoder.ExecutionTests.Require_StringDecoder_MemoryStreamStyle",
          "file": "tests/Jroc.Tests/Node/StringDecoder/ExecutionTests.cs"
        },
        {
          "name": "Jroc.Tests.Node.StringDecoder.GeneratorTests.Require_StringDecoder_Utf8_Basic",
          "file": "tests/Jroc.Tests/Node/StringDecoder/GeneratorTests.cs"
        },
        {
          "name": "Jroc.Tests.Node.StringDecoder.GeneratorTests.Require_StringDecoder_NodePrefix",
          "file": "tests/Jroc.Tests/Node/StringDecoder/GeneratorTests.cs"
        },
        {
          "name": "Jroc.Tests.Node.StringDecoder.GeneratorTests.Require_StringDecoder_MemoryStreamStyle",
          "file": "tests/Jroc.Tests/Node/StringDecoder/GeneratorTests.cs"
        }
      ]
    },
    {
      "name": "write(buffer)",
      "kind": "function",
      "status": "partial",
      "notes": "Buffers incomplete multibyte sequences and returns decoded text.",
      "docs": "https://nodejs.org/api/string_decoder.html#stringdecoderwritebuffer",
      "tests": [
        {
          "name": "Jroc.Tests.Node.StringDecoder.ExecutionTests.Require_StringDecoder_Utf8_Basic",
          "file": "tests/Jroc.Tests/Node/StringDecoder/ExecutionTests.cs"
        },
        {
          "name": "Jroc.Tests.Node.StringDecoder.ExecutionTests.Require_StringDecoder_NodePrefix",
          "file": "tests/Jroc.Tests/Node/StringDecoder/ExecutionTests.cs"
        },
        {
          "name": "Jroc.Tests.Node.StringDecoder.ExecutionTests.Require_StringDecoder_MemoryStreamStyle",
          "file": "tests/Jroc.Tests/Node/StringDecoder/ExecutionTests.cs"
        },
        {
          "name": "Jroc.Tests.Node.StringDecoder.GeneratorTests.Require_StringDecoder_Utf8_Basic",
          "file": "tests/Jroc.Tests/Node/StringDecoder/GeneratorTests.cs"
        },
        {
          "name": "Jroc.Tests.Node.StringDecoder.GeneratorTests.Require_StringDecoder_NodePrefix",
          "file": "tests/Jroc.Tests/Node/StringDecoder/GeneratorTests.cs"
        },
        {
          "name": "Jroc.Tests.Node.StringDecoder.GeneratorTests.Require_StringDecoder_MemoryStreamStyle",
          "file": "tests/Jroc.Tests/Node/StringDecoder/GeneratorTests.cs"
        }
      ]
    },
    {
      "name": "end([buffer])",
      "kind": "function",
      "status": "partial",
      "notes": "Flushes any buffered partial utf8 sequence and accepts an optional final buffer.",
      "docs": "https://nodejs.org/api/string_decoder.html#stringdecoderendbuffer",
      "tests": [
        {
          "name": "Jroc.Tests.Node.StringDecoder.ExecutionTests.Require_StringDecoder_Utf8_Basic",
          "file": "tests/Jroc.Tests/Node/StringDecoder/ExecutionTests.cs"
        },
        {
          "name": "Jroc.Tests.Node.StringDecoder.ExecutionTests.Require_StringDecoder_NodePrefix",
          "file": "tests/Jroc.Tests/Node/StringDecoder/ExecutionTests.cs"
        },
        {
          "name": "Jroc.Tests.Node.StringDecoder.ExecutionTests.Require_StringDecoder_MemoryStreamStyle",
          "file": "tests/Jroc.Tests/Node/StringDecoder/ExecutionTests.cs"
        },
        {
          "name": "Jroc.Tests.Node.StringDecoder.GeneratorTests.Require_StringDecoder_Utf8_Basic",
          "file": "tests/Jroc.Tests/Node/StringDecoder/GeneratorTests.cs"
        },
        {
          "name": "Jroc.Tests.Node.StringDecoder.GeneratorTests.Require_StringDecoder_NodePrefix",
          "file": "tests/Jroc.Tests/Node/StringDecoder/GeneratorTests.cs"
        },
        {
          "name": "Jroc.Tests.Node.StringDecoder.GeneratorTests.Require_StringDecoder_MemoryStreamStyle",
          "file": "tests/Jroc.Tests/Node/StringDecoder/GeneratorTests.cs"
        }
      ]
    }
  ]
}
