{
  "$schema": "./ModuleDoc.schema.json",
  "autoGeneratedHeader": false,
  "name": "child_process",
  "type": "module",
  "status": "partial",
  "docsUrl": "https://nodejs.org/api/child_process.html",
  "nodeVersionTarget": "22.x LTS",
  "implementation": "src/JavaScriptRuntime/Node/ChildProcess.cs",
  "notes": "Provides synchronous process execution, async spawn/exec/execFile, and a documented fork baseline for compiled child modules in the current assembly. The supported slice includes authenticated JSON-only parent/child IPC over loopback (`child.on('message')`, `child.send(...)`, `process.on('message')`, `process.send(...)`), environment overlays, explicit unsupported detached diagnostics across the current async APIs, and a focused `fork({ silent: true|false })` follow-on for common toolchain stdio control. Hosted `JsEngine` runtimes can also use `fork()`, but they must supply `JsModuleLoadOptions.CompiledAssemblyPath` explicitly; hosted fork launch paths are not inferred automatically. Hosts may override process creation through `IChildProcessLauncher`.",
  "apis": [
    {
      "name": "spawn(command[, args][, options])",
      "kind": "function",
      "status": "supported",
      "notes": "Returns an EventEmitter-backed child handle with pid, stdout/stderr Readable pipes, a Writable stdin pipe when piped, exit/close events, and kill(). Supports cwd, shell, and stdio ('pipe'/'inherit'/'ignore' plus basic first-three-entry array handling). Detached launches remain explicit unsupported diagnostics instead of being silently approximated.",
      "docs": "https://nodejs.org/api/child_process.html#child_processspawncommand-args-options",
      "tests": [
        {
          "name": "Jroc.Tests.Node.ChildProcess.ExecutionTests.Require_ChildProcess_Spawn_Basic",
          "file": "tests/Jroc.Tests/Node/ChildProcess/ExecutionTests.cs"
        },
        {
          "name": "Jroc.Tests.Node.ChildProcess.ExecutionTests.Require_ChildProcess_Spawn_Ignore",
          "file": "tests/Jroc.Tests/Node/ChildProcess/ExecutionTests.cs"
        },
        {
          "name": "Jroc.Tests.Node.ChildProcess.GeneratorTests.Require_ChildProcess_Spawn_Basic",
          "file": "tests/Jroc.Tests/Node/ChildProcess/GeneratorTests.cs"
        },
        {
          "name": "Jroc.Tests.Node.ChildProcess.GeneratorTests.Require_ChildProcess_Spawn_Ignore",
          "file": "tests/Jroc.Tests/Node/ChildProcess/GeneratorTests.cs"
        }
      ]
    },
    {
      "name": "exec(command[, options][, callback])",
      "kind": "function",
      "status": "supported",
      "notes": "Executes via a shell and optionally invokes an error-first callback with (err, stdout, stderr). Returns the child handle immediately. Non-zero exit codes surface an Error-like object carrying status/code/stdout/stderr. Detached launches remain explicit unsupported diagnostics.",
      "docs": "https://nodejs.org/api/child_process.html#child_processexeccommand-options-callback",
      "tests": [
        {
          "name": "Jroc.Tests.Node.ChildProcess.ExecutionTests.Require_ChildProcess_Exec_Callback",
          "file": "tests/Jroc.Tests/Node/ChildProcess/ExecutionTests.cs"
        },
        {
          "name": "Jroc.Tests.Node.ChildProcess.GeneratorTests.Require_ChildProcess_Exec_Callback",
          "file": "tests/Jroc.Tests/Node/ChildProcess/GeneratorTests.cs"
        }
      ]
    },
    {
      "name": "execFile(file[, args][, options][, callback])",
      "kind": "function",
      "status": "supported",
      "notes": "Runs a file directly without an implicit shell and optionally invokes an error-first callback with (err, stdout, stderr). Non-zero exits surface the same Error-like callback shape used by exec(). Detached launches remain explicit unsupported diagnostics.",
      "docs": "https://nodejs.org/api/child_process.html#child_processexecfilefile-args-options-callback",
      "tests": [
        {
          "name": "Jroc.Tests.Node.ChildProcess.ExecutionTests.Require_ChildProcess_ExecFile_NonZero",
          "file": "tests/Jroc.Tests/Node/ChildProcess/ExecutionTests.cs"
        },
        {
          "name": "Jroc.Tests.Node.ChildProcess.GeneratorTests.Require_ChildProcess_ExecFile_NonZero",
          "file": "tests/Jroc.Tests/Node/ChildProcess/GeneratorTests.cs"
        }
      ]
    },
    {
      "name": "fork(modulePath[, args][, options])",
      "kind": "function",
      "status": "supported",
      "notes": "Launches another compiled JROC child from the current assembly, resolves `modulePath` relative to the compiled program entry module, and enables an authenticated JSON-only IPC channel by default. Supports `cwd`, merged `env` overrides, stdio values `'pipe'`, `'inherit'`, `'ignore'`, plus `'ipc'` at `stdio[3]`, explicit `options.silent` control (`true` keeps piped stdio, `false` maps stdio[0-2] to `inherit` while preserving IPC), `child.send(...)`, `child.on('message')`, `process.send(...)`, `process.on('message')`, deterministic `disconnect` before `exit`/`close`, and `kill('SIGTERM'|'SIGKILL'|'SIGINT')` reporting. Detached children, advanced serialization, handle passing, and Node-internal IPC behaviors remain explicit unsupported diagnostics. In hosted `JsEngine` scenarios, the child is launched only when the host explicitly supplies `JsModuleLoadOptions.CompiledAssemblyPath`; if that configuration is missing, `fork()` throws a targeted runtime error instead of inferring a launch target. Hosts can customize process creation through `IChildProcessLauncher`.",
      "docs": "https://nodejs.org/api/child_process.html#child_processforkmodulepath-args-options",
      "tests": [
        {
          "name": "Jroc.Tests.Node.ChildProcess.ExecutionTests.Require_ChildProcess_Fork_MessagePassing",
          "file": "tests/Jroc.Tests/Node/ChildProcess/ExecutionTests.cs"
        },
        {
          "name": "Jroc.Tests.Node.ChildProcess.ExecutionTests.Require_ChildProcess_Fork_Kill_And_Env",
          "file": "tests/Jroc.Tests/Node/ChildProcess/ExecutionTests.cs"
        },
        {
          "name": "Jroc.Tests.Node.ChildProcess.ExecutionTests.Require_ChildProcess_Fork_Silent",
          "file": "tests/Jroc.Tests/Node/ChildProcess/ExecutionTests.cs"
        },
        {
          "name": "Jroc.Tests.Node.ChildProcess.ExecutionTests.Require_ChildProcess_Fork_Unsupported_Options",
          "file": "tests/Jroc.Tests/Node/ChildProcess/ExecutionTests.cs"
        },
        {
          "name": "Jroc.Tests.Node.ChildProcess.GeneratorTests.Require_ChildProcess_Fork_MessagePassing",
          "file": "tests/Jroc.Tests/Node/ChildProcess/GeneratorTests.cs"
        },
        {
          "name": "Jroc.Tests.Node.ChildProcess.GeneratorTests.Require_ChildProcess_Fork_Kill_And_Env",
          "file": "tests/Jroc.Tests/Node/ChildProcess/GeneratorTests.cs"
        },
        {
          "name": "Jroc.Tests.Node.ChildProcess.GeneratorTests.Require_ChildProcess_Fork_Silent",
          "file": "tests/Jroc.Tests/Node/ChildProcess/GeneratorTests.cs"
        },
        {
          "name": "Jroc.Tests.Node.ChildProcess.GeneratorTests.Require_ChildProcess_Fork_Unsupported_Options",
          "file": "tests/Jroc.Tests/Node/ChildProcess/GeneratorTests.cs"
        }
      ]
    },
    {
      "name": "spawnSync(command, args, options)",
      "kind": "function",
      "status": "supported",
      "notes": "Supports cwd, shell, environment overrides, and stdio ('pipe'/'inherit'/'ignore' for the first three slots). Returns { status, stdout, stderr }.",
      "docs": "https://nodejs.org/api/child_process.html#child_processspawnsynccommand-args-options"
    },
    {
      "name": "execSync(command, options)",
      "kind": "function",
      "status": "supported",
      "notes": "Supports cwd, environment overrides, stdio ('pipe'/'inherit'/'ignore' for the first three slots), and encoding ('utf8'). Throws an Error-like object with status/code/stdout/stderr on non-zero exit.",
      "docs": "https://nodejs.org/api/child_process.html#child_processexecsynccommand-options"
    }
  ]
}
