{
  "$schema": "./ModuleDoc.schema.json",
  "autoGeneratedHeader": false,
  "name": "util",
  "type": "module",
  "status": "partial",
  "docsUrl": "https://nodejs.org/api/util.html",
  "nodeVersionTarget": "22.x LTS",
  "implementation": "src/JavaScriptRuntime/Node/Util.cs",
  "notes": "Provides essential utility functions for promisifying callbacks, prototype inheritance, placeholder formatting, Node-style object inspection, and type checking for common runtime-backed binary/object shapes.",
  "apis": [
    {
      "name": "promisify(callback)",
      "kind": "function",
      "status": "supported",
      "notes": "Converts error-first callback functions to Promise-returning functions. Follows Node.js error-first convention where the first argument is an error or null, and the second is the result.",
      "docs": "https://nodejs.org/api/util.html#utilpromisifyoriginal",
      "tests": [
        {
          "name": "Jroc.Tests.Node.Util.ExecutionTests.Require_Util_Promisify_Basic",
          "file": "tests/Jroc.Tests/Node/Util/ExecutionTests.cs"
        },
        {
          "name": "Jroc.Tests.Node.Util.ExecutionTests.Require_Util_Promisify_ErrorHandling",
          "file": "tests/Jroc.Tests/Node/Util/ExecutionTests.cs"
        },
        {
          "name": "Jroc.Tests.Node.Util.GeneratorTests.Require_Util_Promisify_Basic",
          "file": "tests/Jroc.Tests/Node/Util/GeneratorTests.cs"
        },
        {
          "name": "Jroc.Tests.Node.Util.GeneratorTests.Require_Util_Promisify_ErrorHandling",
          "file": "tests/Jroc.Tests/Node/Util/GeneratorTests.cs"
        }
      ]
    },
    {
      "name": "inherits(constructor, superConstructor)",
      "kind": "function",
      "status": "supported",
      "notes": "Sets up prototype chain inheritance between constructor functions. This is a legacy API; modern code should use ES6 classes instead. Sets the super_ property on the constructor.",
      "docs": "https://nodejs.org/api/util.html#utilinheritsconstructor-superconstructor",
      "tests": [
        {
          "name": "Jroc.Tests.Node.Util.ExecutionTests.Require_Util_Inherits_Basic",
          "file": "tests/Jroc.Tests/Node/Util/ExecutionTests.cs"
        },
        {
          "name": "Jroc.Tests.Node.Util.GeneratorTests.Require_Util_Inherits_Basic",
          "file": "tests/Jroc.Tests/Node/Util/GeneratorTests.cs"
        }
      ]
    },
    {
      "name": "format(format[, ...args])",
      "kind": "function",
      "status": "supported",
      "notes": "Formats a string using placeholders like %s, %d/%i, %f, %j, %o/%O, and %% and appends any extra arguments separated by spaces.",
      "docs": "https://nodejs.org/api/util.html#utilformatformat-args",
      "tests": [
        {
          "name": "Jroc.Tests.Node.Util.ExecutionTests.Require_Util_Format_Basic",
          "file": "tests/Jroc.Tests/Node/Util/ExecutionTests.cs"
        },
        {
          "name": "Jroc.Tests.Node.Util.GeneratorTests.Require_Util_Format_Basic",
          "file": "tests/Jroc.Tests/Node/Util/GeneratorTests.cs"
        }
      ]
    },
    {
      "name": "types",
      "kind": "property",
      "status": "partial",
      "notes": "Provides type-checking functions. Supported checks: isArray, isDate, isError, isFunction, isPromise, isRegExp, isString, isNumber, isBoolean, isUndefined, isNull, isObject, isBigInt, isSymbol, isAsyncFunction (including generated async function objects), isMap, isSet, isProxy, isTypedArray, isAnyArrayBuffer, isArrayBuffer, isDataView, isUint8Array, isInt32Array, and isFloat64Array. Compatibility shims for unsupported runtime types such as SharedArrayBuffer and non-implemented typed-array flavors are also exposed and currently return false.",
      "docs": "https://nodejs.org/api/util.html#utiltypes",
      "tests": [
        {
          "name": "Jroc.Tests.Node.Util.ExecutionTests.Require_Util_Types_IsPromise",
          "file": "tests/Jroc.Tests/Node/Util/ExecutionTests.cs"
        },
        {
          "name": "Jroc.Tests.Node.Util.ExecutionTests.Require_Util_Types_IsArray",
          "file": "tests/Jroc.Tests/Node/Util/ExecutionTests.cs"
        },
        {
          "name": "Jroc.Tests.Node.Util.ExecutionTests.Require_Util_Types_IsFunction",
          "file": "tests/Jroc.Tests/Node/Util/ExecutionTests.cs"
        },
        {
          "name": "Jroc.Tests.Node.Util.ExecutionTests.Require_Util_Types_Expanded",
          "file": "tests/Jroc.Tests/Node/Util/ExecutionTests.cs"
        },
        {
          "name": "Jroc.Tests.Node.Util.ExecutionTests.Require_Util_Types_Generated_Functions",
          "file": "tests/Jroc.Tests/Node/Util/ExecutionTests.cs"
        },
        {
          "name": "Jroc.Tests.Node.Util.ExecutionTests.Require_Util_Types_TypedBinary",
          "file": "tests/Jroc.Tests/Node/Util/ExecutionTests.cs"
        },
        {
          "name": "Jroc.Tests.Node.Util.GeneratorTests.Require_Util_Types_IsPromise",
          "file": "tests/Jroc.Tests/Node/Util/GeneratorTests.cs"
        },
        {
          "name": "Jroc.Tests.Node.Util.GeneratorTests.Require_Util_Types_IsArray",
          "file": "tests/Jroc.Tests/Node/Util/GeneratorTests.cs"
        },
        {
          "name": "Jroc.Tests.Node.Util.GeneratorTests.Require_Util_Types_IsFunction",
          "file": "tests/Jroc.Tests/Node/Util/GeneratorTests.cs"
        },
        {
          "name": "Jroc.Tests.Node.Util.GeneratorTests.Require_Util_Types_Expanded",
          "file": "tests/Jroc.Tests/Node/Util/GeneratorTests.cs"
        },
        {
          "name": "Jroc.Tests.Node.Util.GeneratorTests.Require_Util_Types_TypedBinary",
          "file": "tests/Jroc.Tests/Node/Util/GeneratorTests.cs"
        }
      ]
    },
    {
      "name": "inspect(value[, options])",
      "kind": "function",
      "status": "partial",
      "notes": "Provides basic object inspection for debugging. Supports depth limiting, circular references, typed-array/ArrayBuffer/DataView formatting, and Node's custom inspect hook via util.inspect.custom (Symbol.for('nodejs.util.inspect.custom')). Options supported: depth, showHidden, colors (parsed but colors not applied to output).",
      "docs": "https://nodejs.org/api/util.html#utilinspectobject-options",
      "tests": [
        {
          "name": "Jroc.Tests.Node.Util.ExecutionTests.Require_Util_Inspect_Basic",
          "file": "tests/Jroc.Tests/Node/Util/ExecutionTests.cs"
        },
        {
          "name": "Jroc.Tests.Node.Util.ExecutionTests.Require_Util_Inspect_Object",
          "file": "tests/Jroc.Tests/Node/Util/ExecutionTests.cs"
        },
        {
          "name": "Jroc.Tests.Node.Util.ExecutionTests.Require_Util_Inspect_Custom",
          "file": "tests/Jroc.Tests/Node/Util/ExecutionTests.cs"
        },
        {
          "name": "Jroc.Tests.Node.Util.ExecutionTests.Require_Util_Inspect_TypedBinary",
          "file": "tests/Jroc.Tests/Node/Util/ExecutionTests.cs"
        },
        {
          "name": "Jroc.Tests.Node.Util.GeneratorTests.Require_Util_Inspect_Basic",
          "file": "tests/Jroc.Tests/Node/Util/GeneratorTests.cs"
        },
        {
          "name": "Jroc.Tests.Node.Util.GeneratorTests.Require_Util_Inspect_Object",
          "file": "tests/Jroc.Tests/Node/Util/GeneratorTests.cs"
        },
        {
          "name": "Jroc.Tests.Node.Util.GeneratorTests.Require_Util_Inspect_Custom",
          "file": "tests/Jroc.Tests/Node/Util/GeneratorTests.cs"
        },
        {
          "name": "Jroc.Tests.Node.Util.GeneratorTests.Require_Util_Inspect_TypedBinary",
          "file": "tests/Jroc.Tests/Node/Util/GeneratorTests.cs"
        }
      ]
    }
  ]
}
