{
  "$schema": "./ModuleDoc.schema.json",
  "autoGeneratedHeader": false,
  "name": "Promise",
  "type": "global",
  "status": "supported",
  "docsUrl": "https://nodejs.org/api/globals.html#promise",
  "nodeVersionTarget": "22.x LTS",
  "implementation": "src/JavaScriptRuntime/Promise.cs, src/JavaScriptRuntime/Engine/EngineCore.cs",
  "notes": "Promise/A+ compliant implementation with microtask scheduling via IMicrotaskScheduler. Supports constructor, Promise.resolve(), Promise.reject(), then(), catch(), and finally(). Includes proper handling of returned Promises in handlers and chaining semantics.",
  "tests": [
    {
      "name": "Jroc.Tests.Promise.ExecutionTests.Promise_Executor_Resolved",
      "file": "tests/Jroc.Tests/Promise/ExecutionTests.cs"
    },
    {
      "name": "Jroc.Tests.Promise.ExecutionTests.Promise_Executor_Rejected",
      "file": "tests/Jroc.Tests/Promise/ExecutionTests.cs"
    },
    {
      "name": "Jroc.Tests.Promise.ExecutionTests.Promise_Resolve_Then",
      "file": "tests/Jroc.Tests/Promise/ExecutionTests.cs"
    },
    {
      "name": "Jroc.Tests.Promise.ExecutionTests.Promise_Reject_Then",
      "file": "tests/Jroc.Tests/Promise/ExecutionTests.cs"
    },
    {
      "name": "Jroc.Tests.Promise.ExecutionTests.Promise_Resolve_ThenFinally",
      "file": "tests/Jroc.Tests/Promise/ExecutionTests.cs"
    },
    {
      "name": "Jroc.Tests.Promise.ExecutionTests.Promise_Reject_FinallyCatch",
      "file": "tests/Jroc.Tests/Promise/ExecutionTests.cs"
    },
    {
      "name": "Jroc.Tests.Promise.ExecutionTests.Promise_Resolve_FinallyThen",
      "file": "tests/Jroc.Tests/Promise/ExecutionTests.cs"
    },
    {
      "name": "Jroc.Tests.Promise.ExecutionTests.Promise_Resolve_FinallyThrows",
      "file": "tests/Jroc.Tests/Promise/ExecutionTests.cs"
    },
    {
      "name": "Jroc.Tests.Promise.ExecutionTests.Promise_Then_ReturnsResolvedPromise",
      "file": "tests/Jroc.Tests/Promise/ExecutionTests.cs"
    },
    {
      "name": "Jroc.Tests.Promise.ExecutionTests.Promise_Then_ReturnsRejectedPromise",
      "file": "tests/Jroc.Tests/Promise/ExecutionTests.cs"
    },
    {
      "name": "Jroc.Tests.Promise.ExecutionTests.Promise_Catch_ReturnsResolvedPromise",
      "file": "tests/Jroc.Tests/Promise/ExecutionTests.cs"
    },
    {
      "name": "Jroc.Tests.Promise.ExecutionTests.Promise_Catch_ReturnsRejectedPromise",
      "file": "tests/Jroc.Tests/Promise/ExecutionTests.cs"
    },
    {
      "name": "Jroc.Tests.Promise.ExecutionTests.Promise_Finally_ReturnsResolvedPromise",
      "file": "tests/Jroc.Tests/Promise/ExecutionTests.cs"
    },
    {
      "name": "Jroc.Tests.Promise.ExecutionTests.Promise_Finally_ReturnsRejectedPromise",
      "file": "tests/Jroc.Tests/Promise/ExecutionTests.cs"
    },
    {
      "name": "Jroc.Tests.Promise.ExecutionTests.Promise_Scheduling_StarvationTest",
      "file": "tests/Jroc.Tests/Promise/ExecutionTests.cs"
    }
  ]
}
