{
  "$schema": "./ModuleDoc.schema.json",
  "autoGeneratedHeader": false,
  "name": "URL",
  "fileName": "URL_global",
  "type": "global",
  "status": "supported",
  "docsUrl": "https://nodejs.org/api/url.html#new-urlinput-base",
  "nodeVersionTarget": "22.x LTS",
  "implementation": [
    "src/JavaScriptRuntime/GlobalThis.cs",
    "src/JavaScriptRuntime/Node/Url.cs"
  ],
  "notes": "Exposes the WHATWG `URL` constructor on `globalThis` and reuses the same constructor object exported by `require(\"url\")` / `require(\"node:url\")`, including `Function.prototype` linkage, `.prototype`, `.constructor`, `instanceof`, and `new`-required behavior.",
  "tests": [
    {
      "name": "Jroc.Tests.Node.Url.ExecutionTests.Global_Url_And_SearchParams",
      "file": "tests/Jroc.Tests/Node/Url/ExecutionTests.cs"
    },
    {
      "name": "Jroc.Tests.Node.Url.GeneratorTests.Global_Url_And_SearchParams",
      "file": "tests/Jroc.Tests/Node/Url/GeneratorTests.cs"
    }
  ]
}
