{
  "$schema": "./ModuleDoc.schema.json",
  "autoGeneratedHeader": false,
  "name": "Atomics",
  "type": "global",
  "status": "partial",
  "docsUrl": "https://nodejs.org/api/globals.html#class-atomics",
  "nodeVersionTarget": "22.x LTS",
  "implementation": [
    "src/JavaScriptRuntime/Atomics.cs",
    "src/JavaScriptRuntime/GlobalThis.cs",
    "src/JavaScriptRuntime/Int32Array.cs",
    "src/JavaScriptRuntime/SharedArrayBuffer.cs"
  ],
  "notes": "Minimal global support added to keep the compiled scripts/release.js canary runnable under JROC. Only Atomics.wait(...) is currently exposed, and it is implemented as a blocking timeout sleep suitable for the release-script polling path rather than full shared-memory synchronization semantics.",
  "tests": [
    {
      "name": "Jroc.Tests.TypedArray.ExecutionTests.SharedArrayBuffer_Int32Array_AtomicsWait",
      "file": "tests/Jroc.Tests/TypedArray/ExecutionTests.cs"
    },
    {
      "name": "Jroc.Tests.TypedArray.GeneratorTests.SharedArrayBuffer_Int32Array_AtomicsWait",
      "file": "tests/Jroc.Tests/TypedArray/GeneratorTests.cs"
    }
  ],
  "apis": [
    {
      "name": "wait(typedArray, index, value, timeout)",
      "kind": "function",
      "status": "partial",
      "docs": "https://nodejs.org/api/globals.html#atomicswaittypedarray-index-value-timeout",
      "notes": "Currently supports the release canary shape with Int32Array views backed by SharedArrayBuffer and returns `\"not-equal\"` or `\"timed-out\"`. Does not yet implement full ECMAScript shared-memory wait/notify behavior.",
      "tests": [
        {
          "name": "Jroc.Tests.TypedArray.ExecutionTests.SharedArrayBuffer_Int32Array_AtomicsWait",
          "file": "tests/Jroc.Tests/TypedArray/ExecutionTests.cs"
        },
        {
          "name": "Jroc.Tests.TypedArray.GeneratorTests.SharedArrayBuffer_Int32Array_AtomicsWait",
          "file": "tests/Jroc.Tests/TypedArray/GeneratorTests.cs"
        }
      ]
    }
  ]
}
