{
  "$schema": "./ModuleDoc.schema.json",
  "autoGeneratedHeader": false,
  "name": "setImmediate",
  "type": "global",
  "status": "supported",
  "docsUrl": "https://nodejs.org/api/timers.html#setimmediatecallback-args",
  "nodeVersionTarget": "22.x LTS",
  "implementation": "src/JavaScriptRuntime/GlobalThis.cs, src/JavaScriptRuntime/Timers.cs, src/JavaScriptRuntime/Engine/NodeSchedulerState.cs, src/JavaScriptRuntime/Engine/NodeEventLoopPump.cs",
  "notes": "Schedules a callback to run on the next event loop iteration. Callbacks execute in FIFO order. Nested setImmediate calls run on the next iteration. Returns a handle that can be used with clearImmediate.",
  "tests": [
    {
      "name": "Jroc.Tests.Node.Timers.ExecutionTests.SetImmediate_ExecutesCallback",
      "file": "tests/Jroc.Tests/Node/Timers/ExecutionTests.cs"
    },
    {
      "name": "Jroc.Tests.Node.Timers.ExecutionTests.SetImmediate_WithArgs_PassesCorrectly",
      "file": "tests/Jroc.Tests/Node/Timers/ExecutionTests.cs"
    },
    {
      "name": "Jroc.Tests.Node.Timers.ExecutionTests.SetImmediate_Multiple_ExecuteInOrder",
      "file": "tests/Jroc.Tests/Node/Timers/ExecutionTests.cs"
    },
    {
      "name": "Jroc.Tests.Node.Timers.ExecutionTests.SetImmediate_ExecutesBeforeSetTimeout",
      "file": "tests/Jroc.Tests/Node/Timers/ExecutionTests.cs"
    },
    {
      "name": "Jroc.Tests.Node.Timers.ExecutionTests.SetImmediate_Nested_ExecutesInNextIteration",
      "file": "tests/Jroc.Tests/Node/Timers/ExecutionTests.cs"
    }
  ]
}
