{
  "$schema": "./ModuleDoc.schema.json",
  "autoGeneratedHeader": false,
  "name": "clearTimeout",
  "type": "global",
  "status": "supported",
  "docsUrl": "https://nodejs.org/api/timers.html#cleartimeouttimeout",
  "nodeVersionTarget": "22.x LTS",
  "implementation": "src/JavaScriptRuntime/GlobalThis.cs, src/JavaScriptRuntime/Timers.cs",
  "notes": "Cancels a timer that was previously created with setTimeout, including a refreshable Timeout handle. Returns undefined (null in .NET).",
  "tests": [
    {
      "name": "Jroc.Tests.Node.ExecutionTests.ClearTimeout_ZeroDelay",
      "file": "tests/Jroc.Tests/Node/ExecutionTests.cs"
    },
    {
      "name": "Jroc.Tests.Node.ExecutionTests.ClearTimeout_MultipleZeroDelay_ClearSecondTimer",
      "file": "tests/Jroc.Tests/Node/ExecutionTests.cs"
    }
  ]
}
