{
  "$schema": "./ModuleDoc.schema.json",
  "autoGeneratedHeader": false,
  "name": "dns",
  "type": "module",
  "status": "partial",
  "docsUrl": "https://nodejs.org/api/dns.html",
  "nodeVersionTarget": "24.x LTS",
  "implementation": [
    "src/JavaScriptRuntime/Node/Dns.cs",
    "src/JavaScriptRuntime/Node/Contracts/IDnsModule.Generated.cs"
  ],
  "notes": "Provides the callback-based dns.lookup() behavior required by Undici. Lookup is asynchronous, preserves Node's error-first callback shape, supports hostname literals and operating-system name resolution, and supports the family, all, order, and verbatim options. Direct DNS record resolution, Resolver instances, custom DNS servers, DNS constants and error codes, and dns.promises are represented by the complete generated Node 24 contract but currently fail explicitly.",
  "apis": [
    {
      "name": "lookup(hostname[, options], callback)",
      "kind": "function",
      "status": "supported",
      "docs": "https://nodejs.org/api/dns.html#dnslookuphostname-options-callback",
      "notes": "Supports asynchronous error-first callbacks, family 0/4/6 and IPv4/IPv6 selection, all result records, result ordering, and the deprecated verbatim option.",
      "tests": [
        {
          "name": "Jroc.Tests.Node.Dns.ExecutionTests.Require_Dns_Lookup",
          "file": "tests/Jroc.Tests/Node/Dns/ExecutionTests.cs"
        },
        {
          "name": "Jroc.Tests.Node.Dns.GeneratorTests.Require_Dns_Lookup",
          "file": "tests/Jroc.Tests/Node/Dns/GeneratorTests.cs"
        }
      ]
    },
    {
      "name": "getDefaultResultOrder() / setDefaultResultOrder(order)",
      "kind": "function",
      "status": "supported",
      "docs": "https://nodejs.org/api/dns.html#dnsgetdefaultresultorder",
      "notes": "Supports verbatim, ipv4first, and ipv6first defaults used when lookup options do not specify an order."
    },
    {
      "name": "Resolver, resolve*, reverse, lookupService, getServers, setServers, constants, and promises",
      "kind": "property",
      "status": "not-supported",
      "docs": "https://nodejs.org/api/dns.html",
      "notes": "These Node 24 exports remain available in the generated contract and throw NotImplementedException explicitly when accessed through that contract."
    }
  ]
}
